[
{"id":"P-001","level":"A1.1","kind":"contrast","label":"/ɪ/ vs /iː/ — KIT vs FLEECE","ipa":"ɪ ~ iː","articulation":{"instruction_en":"For /iː/ the tongue is high and forward and the sound is long. For /ɪ/ the tongue is slightly lower and more relaxed, and the sound is short.","instruction_uz":"/iː/ uzun va til yuqorida-oldinda. /ɪ/ qisqa, til biroz pastroq va bo'shashgan. Bu FAQAT uzunlik farqi emas — tovush sifati ham boshqa.","self_check":"Say 'sheep' and 'ship'. Your mouth should change shape, not only the length."},"minimal_pairs":[["ship","sheep"],["bit","beat"],["live","leave"],["fit","feet"],["it","eat"],["sit","seat"],["hill","heal"],["is","ease"],["fill","feel"],["chip","cheap"],["slip","sleep"],["bin","bean"],["rich","reach"],["this","these"],["will","wheel"],["mill","meal"],["pick","peak"],["still","steal"],["din","dean"],["lick","leak"]],"example_words":["big","this","English","teacher","meet","see"],"l1_substitutions":{"uz":"Ikkalasi ham [i] deb aytiladi","ru":"Оба звука произносятся как [и]","tr":"[i]"},"l1_priority":{"uz":1,"ru":1,"tr":1,"es":1},"gate":{"trials":20,"accuracy":0.9},"first_taught_node":"S01U03N1","status":"published","syllabus_version":"1.0"},
{"id":"P-002","level":"A1.1","kind":"phoneme","label":"/iː/ FLEECE","ipa":"iː","articulation":{"place":"close front","instruction_en":"Long, tense, tongue high and forward; lips slightly spread.","instruction_uz":"Uzun, taranglashgan; til yuqorida va oldinda, lablar biroz cho'zilgan."},"example_words":["see","meet","teacher","three","week","eat"],"l1_priority":{"uz":2},"first_taught_node":"S01U01N1","status":"published","syllabus_version":"1.0"},
{"id":"P-003","level":"A1.1","kind":"phoneme","label":"/æ/ TRAP","ipa":"æ","articulation":{"place":"near-open front","instruction_en":"Open your mouth wide and keep the tongue low and forward. It is not the same as /e/ in 'bed' or /ɑː/ in 'father'.","instruction_uz":"Og'izni keng oching, til pastda va oldinda. Bu 'bed' dagi /e/ ham, 'father' dagi /ɑː/ ham EMAS. O'zbek tilida bu tovush yo'q.","self_check":"Put a finger between your teeth — for /æ/ the jaw drops more than for /e/."},"minimal_pairs":[["bad","bed"],["man","men"],["sat","set"],["had","head"],["bat","bet"],["pan","pen"],["and","end"],["land","lend"],["sad","said"],["mat","met"],["cat","cut"],["bat","but"],["ran","run"],["match","much"],["bag","bug"]],"example_words":["bad","bag","cat","man","apple","black"],"l1_substitutions":{"uz":"[a] yoki [e]","ru":"[э] или [а]"},"l1_priority":{"uz":1,"ru":1,"tr":1},"gate":{"trials":20,"accuracy":0.9},"first_taught_node":"S01U03N3","status":"published","syllabus_version":"1.0"},
{"id":"P-004","level":"A1.1","kind":"phoneme","label":"/e/ DRESS","ipa":"e","articulation":{"place":"mid front","instruction_en":"Tongue mid-high and forward; shorter and less open than /æ/.","instruction_uz":"Til o'rta balandlikda va oldinda; /æ/ dan qisqaroq va yopiqroq."},"example_words":["red","bed","ten","seven","yes","get"],"l1_priority":{"uz":3},"first_taught_node":"S01U03N3","status":"published","syllabus_version":"1.0"},
{"id":"P-005","level":"A1.1","kind":"phoneme","label":"/ʌ/ STRUT","ipa":"ʌ","articulation":{"place":"open-mid central","instruction_en":"A short, central, relaxed vowel — the tongue is in the middle of the mouth.","instruction_uz":"Qisqa, markaziy, bo'shashgan unli — til og'iz o'rtasida. O'zbekcha [a] dan farqli."},"minimal_pairs":[["cut","cat"],["but","bat"],["run","ran"],["much","match"],["luck","lock"],["cup","cop"],["done","don"],["nut","not"],["hut","hot"],["bus","boss"]],"example_words":["but","cup","much","money","son","country"],"l1_substitutions":{"uz":"[a]"},"l1_priority":{"uz":2},"first_taught_node":"S01U04N1","status":"published","syllabus_version":"1.0"},
{"id":"P-006","level":"A1.1","kind":"phoneme","label":"/ɑː/ LOT / PALM","ipa":"ɑː","articulation":{"place":"open back","instruction_en":"Open your mouth and pull the tongue back and low.","instruction_uz":"Og'izni oching, tilni orqaga va pastga torting."},"example_words":["father","car","not","stop","hot","park"],"l1_priority":{"uz":3},"first_taught_node":"S01U05N1","status":"published","syllabus_version":"1.0"},
{"id":"P-007","level":"A1.1","kind":"phoneme","label":"/oʊ/ GOAT","ipa":"oʊ","articulation":{"instruction_en":"This is a diphthong: start at /o/ and glide towards /ʊ/. It is not a single pure [o].","instruction_uz":"Bu diftong: /o/ dan boshlanib /ʊ/ tomon siljiydi. Bu sof [o] EMAS — lablar harakatlanadi."},"minimal_pairs":[["coat","caught"],["so","saw"],["boat","bought"],["low","law"],["phone","fawn"]],"example_words":["go","no","phone","home","old","know"],"l1_substitutions":{"uz":"sof [o] — siljish yo'q","ru":"[о]"},"l1_priority":{"uz":2},"first_taught_node":"S01U01N1","status":"published","syllabus_version":"1.0"},
{"id":"P-008","level":"A1.2","kind":"phoneme","label":"/ð/ — voiced TH","ipa":"ð","articulation":{"place":"dental","manner":"fricative","voice":true,"instruction_en":"Put the tip of your tongue lightly between your teeth and blow, with your voice on.","instruction_uz":"Til uchini tishlar orasiga yengil qo'ying va ovoz bilan puflang. Bu [d] ham, [z] ham EMAS.","self_check":"Touch your throat — it should vibrate. You should feel your tongue touch your top teeth."},"minimal_pairs":[["they","day"],["there","dare"],["then","den"],["breathe","breed"],["those","doze"],["that","dat"],["clothing","closing"],["breathe","breeze"],["with","wiz"],["other","udder"]],"example_words":["the","this","that","they","mother","father","there","with","weather","other"],"l1_substitutions":{"uz":"[d] yoki [z]","ru":"[д] или [з]","tr":"[d]"},"l1_priority":{"uz":1,"ru":1,"tr":1},"gate":{"trials":20,"accuracy":0.9},"first_taught_node":"S01U01N2","status":"published","syllabus_version":"1.0"},
{"id":"P-009","level":"A1.2","kind":"phoneme","label":"/θ/ — voiceless TH","ipa":"θ","articulation":{"place":"dental","manner":"fricative","voice":false,"instruction_en":"Tongue tip lightly between the teeth, blow air — no voice.","instruction_uz":"Til uchi tishlar orasida, havo puflanadi — ovoz YO'Q. Bu [s] ham, [t] ham EMAS.","self_check":"Hold a finger in front of your mouth — you should feel a steady stream of air."},"minimal_pairs":[["think","sink"],["thick","sick"],["thin","sin"],["mouth","mouse"],["path","pass"],["thing","sing"],["three","tree"],["thought","taught"],["thin","tin"],["both","boat"],["math","mat"],["fourth","fort"],["worth","wart"],["theme","team"],["thank","tank"]],"example_words":["three","thank","think","month","birthday","north","health","both","thin","mouth"],"l1_substitutions":{"uz":"[s] yoki [t]","ru":"[с] или [т]","tr":"[t]"},"l1_priority":{"uz":1,"ru":1,"tr":1},"gate":{"trials":20,"accuracy":0.9},"first_taught_node":"S01U03N1","status":"published","syllabus_version":"1.0"},
{"id":"P-010","level":"A1.1","kind":"contrast","label":"/w/ vs /v/","ipa":"w ~ v","articulation":{"instruction_en":"For /w/ round your lips like a small circle — your teeth do not touch your lip. For /v/ your top teeth touch your bottom lip.","instruction_uz":"/w/ uchun lablarni doira qilib cho'ching — tishlar labga TEGMAYDI. /v/ uchun yuqori tishlar pastki labga tegadi.","self_check":"Say 'west'. If you feel your teeth on your lip, you said 'vest'."},"minimal_pairs":[["west","vest"],["wine","vine"],["wet","vet"],["worse","verse"],["while","vile"],["wary","very"],["wail","veil"],["went","vent"],["wiper","viper"],["we","V"]],"example_words":["we","water","window","one","very","five","love","live","have","seven"],"l1_substitutions":{"uz":"ikkalasi ham [v]","ru":"[в]","tr":"[v]"},"l1_priority":{"uz":1,"ru":1,"tr":1},"gate":{"trials":20,"accuracy":0.9},"first_taught_node":"S01U01N2","status":"published","syllabus_version":"1.0"},
{"id":"P-011","level":"A1.2","kind":"phoneme","label":"/ŋ/ — NG","ipa":"ŋ","articulation":{"place":"velar","manner":"nasal","voice":true,"instruction_en":"The back of the tongue touches the soft palate and the air goes through the nose. Do not add a [g] at the end.","instruction_uz":"Til orqasi yumshoq tanglayga tegadi, havo burundan chiqadi. Oxiriga [g] QO'SHMANG: 'sing' = /sɪŋ/, 'sing-g' emas."},"minimal_pairs":[["thin","thing"],["sin","sing"],["ban","bang"],["ran","rang"],["win","wing"],["ton","tongue"],["son","song"],["run","rung"]],"example_words":["English","thing","young","song","strong","morning","long","bank","think","sing"],"l1_substitutions":{"uz":"[n] yoki [ng]"},"l1_priority":{"uz":3},"first_taught_node":"S01U02N1","status":"published","syllabus_version":"1.0"},
{"id":"P-012","level":"A1.1","kind":"phoneme","label":"/r/ — American r","ipa":"ɹ","articulation":{"instruction_en":"The tongue tip curls back slightly or bunches up, but never touches the roof of the mouth. In American English the r is pronounced everywhere, including at the end of words.","instruction_uz":"Til uchi biroz orqaga buriladi yoki to'planadi, lekin tanglayga TEGMAYDI. Amerikacha talaffuzda 'r' hamma joyda o'qiladi.","self_check":"Your tongue should not tap or trill. A trilled r is still understandable — this is not a priority."},"example_words":["red","are","teacher","four","work","morning"],"l1_substitutions":{"uz":"titroq [r]"},"l1_priority":{"uz":5},"first_taught_node":"S01U02N1","status":"published","syllabus_version":"1.0"},
{"id":"P-013","level":"A1.2","kind":"phoneme","label":"/ʊ/ FOOT","ipa":"ʊ","articulation":{"instruction_en":"Short and relaxed, lips only slightly rounded — shorter and more central than /uː/.","instruction_uz":"Qisqa va bo'shashgan, lablar biroz doiralangan — /uː/ dan qisqaroq va markaziyroq."},"minimal_pairs":[["full","fool"],["pull","pool"],["look","Luke"],["could","cooed"],["should","shooed"]],"example_words":["book","good","look","cook","put","would"],"l1_priority":{"uz":2},"first_taught_node":"S01U03N2","status":"published","syllabus_version":"1.0"},